<?xml version="1.0" encoding="UTF-8"?>
<dataroot xmlns:od="urn:schemas-microsoft-com:officedata" xmlns:xsi="http://www.w3.org/2001/XMLSchema-instance"  xsi:noNamespaceSchemaLocation="01_InstrumentEntities.xsd" generated="2025-08-28T15:29:56">
<_x0030_1_InstrumentEntities>
<InstrumentEntityTypeID>1</InstrumentEntityTypeID>
<InstrumentEntityType>Instrument</InstrumentEntityType>
<TableSource>10_Instruments</TableSource>
</_x0030_1_InstrumentEntities>
<_x0030_1_InstrumentEntities>
<InstrumentEntityTypeID>2</InstrumentEntityTypeID>
<InstrumentEntityType>InstrumentComponent</InstrumentEntityType>
<TableSource>11_InstrumentComponents</TableSource>
</_x0030_1_InstrumentEntities>
<_x0030_1_InstrumentEntities>
<InstrumentEntityTypeID>3</InstrumentEntityTypeID>
<InstrumentEntityType>Item</InstrumentEntityType>
<TableSource>20_Items</TableSource>
</_x0030_1_InstrumentEntities>
<_x0030_1_InstrumentEntities>
<InstrumentEntityTypeID>4</InstrumentEntityTypeID>
<InstrumentEntityType>ItemStem</InstrumentEntityType>
<TableSource>21_ItemStems</TableSource>
</_x0030_1_InstrumentEntities>
<_x0030_1_InstrumentEntities>
<InstrumentEntityTypeID>5</InstrumentEntityTypeID>
<InstrumentEntityType>ItemStemConcept</InstrumentEntityType>
<TableSource>22_ItemStemConcepts</TableSource>
</_x0030_1_InstrumentEntities>
<_x0030_1_InstrumentEntities>
<InstrumentEntityTypeID>6</InstrumentEntityTypeID>
<InstrumentEntityType>Codebook</InstrumentEntityType>
<TableSource>30_Codebooks</TableSource>
</_x0030_1_InstrumentEntities>
<_x0030_1_InstrumentEntities>
<InstrumentEntityTypeID>7</InstrumentEntityTypeID>
<InstrumentEntityType>ResponseOption</InstrumentEntityType>
<TableSource>31_ResponseOptions</TableSource>
</_x0030_1_InstrumentEntities>
<_x0030_1_InstrumentEntities>
<InstrumentEntityTypeID>8</InstrumentEntityTypeID>
<InstrumentEntityType>ResponseOptionConcept</InstrumentEntityType>
<TableSource>34_ResponseOptionConcepts</TableSource>
</_x0030_1_InstrumentEntities>
<_x0030_1_InstrumentEntities>
<InstrumentEntityTypeID>9</InstrumentEntityTypeID>
<InstrumentEntityType>Scale</InstrumentEntityType>
<TableSource>40_Scales</TableSource>
</_x0030_1_InstrumentEntities>
<_x0030_1_InstrumentEntities>
<InstrumentEntityTypeID>10</InstrumentEntityTypeID>
<InstrumentEntityType>InstrumentCollections</InstrumentEntityType>
<TableSource>00_InstrumentCollections</TableSource>
</_x0030_1_InstrumentEntities>
</dataroot>
